{
  "schema_version": "1.0.0",
  "publication_version": "1.0.0",
  "profile": "node",
  "description": "Base environment plus a pinned Node.js toolchain",
  "catalog_checksum": "sha256:ad15bb347eea66d9d89bb7c0d9d8f4e2cfe6d024b6eaf253af8f263b3a6c7a82",
  "registry_checksum": "sha256:2ec2581ab7ebe4c4b898abe139f8ac8dd0b3b9b69e89a04f9ac81ff5df988c16",
  "profile_checksum": "sha256:fd7e45455b05a7c46babdcbc2b4a53d3c05304023dd14e9dad01d7cb77d85241",
  "cache_key": "sha256:95e8c4ed834b5fd3675cfa485a0b0bdd79ccffb7d263c54c90719440862c46f1",
  "contents": {
    "capabilities": [
      "realm-base",
      "build-toolchain",
      "common-cli",
      "node-toolchain"
    ],
    "packages": {
      "docker": [
        "apt:build-essential",
        "apt:ca-certificates",
        "apt:ccache",
        "apt:clang",
        "apt:clang-format",
        "apt:clang-tidy",
        "apt:cmake",
        "apt:curl",
        "apt:file",
        "apt:git-lfs",
        "apt:gnupg",
        "apt:jq",
        "apt:make",
        "apt:ninja-build",
        "apt:openssh-client",
        "apt:pkg-config",
        "apt:rsync",
        "apt:tree",
        "apt:unzip",
        "apt:wget",
        "apt:xz-utils",
        "apt:zip"
      ],
      "devcontainer": [
        "apt:build-essential",
        "apt:ca-certificates",
        "apt:ccache",
        "apt:clang",
        "apt:clang-format",
        "apt:clang-tidy",
        "apt:cmake",
        "apt:curl",
        "apt:file",
        "apt:git-lfs",
        "apt:gnupg",
        "apt:jq",
        "apt:make",
        "apt:ninja-build",
        "apt:openssh-client",
        "apt:pkg-config",
        "apt:rsync",
        "apt:tree",
        "apt:unzip",
        "apt:wget",
        "apt:xz-utils",
        "apt:zip"
      ],
      "nix": [
        "nix:cacert",
        "nix:ccache",
        "nix:clang",
        "nix:cmake",
        "nix:corepack",
        "nix:curl",
        "nix:file",
        "nix:git-lfs",
        "nix:gnumake",
        "nix:gnupg",
        "nix:jq",
        "nix:ninja",
        "nix:nodejs_24",
        "nix:openssh",
        "nix:pkg-config",
        "nix:rsync",
        "nix:tree",
        "nix:unzip",
        "nix:wget",
        "nix:xz",
        "nix:zip"
      ],
      "workstation": [
        "nix:cacert",
        "nix:ccache",
        "nix:clang",
        "nix:cmake",
        "nix:corepack",
        "nix:curl",
        "nix:file",
        "nix:git-lfs",
        "nix:gnumake",
        "nix:gnupg",
        "nix:jq",
        "nix:ninja",
        "nix:nodejs_24",
        "nix:openssh",
        "nix:pkg-config",
        "nix:rsync",
        "nix:tree",
        "nix:unzip",
        "nix:wget",
        "nix:xz",
        "nix:zip"
      ]
    },
    "artifacts": [
      {
        "name": "node",
        "version": "24.6.0",
        "source": "https://github.com/nodejs/node@v24.6.0",
        "capability": "node-toolchain"
      }
    ],
    "tools": [
      {
        "id": "node",
        "license": "MIT",
        "owner": "egohygiene/realm",
        "source": "https://github.com/nodejs/node@v24.6.0",
        "stable_capability": "node-toolchain"
      }
    ]
  },
  "support": [
    {
      "platform": "linux/amd64",
      "projections": [
        "docker",
        "devcontainer",
        "nix",
        "workstation"
      ]
    },
    {
      "platform": "linux/arm64",
      "projections": [
        "docker",
        "devcontainer",
        "nix",
        "workstation"
      ]
    }
  ],
  "size": {
    "status": "unmeasured",
    "metric": "expanded OCI image bytes",
    "owner": "Realm issue #6",
    "command": "task image:size ARCH=\"<amd64|arm64>\" IMAGE=\"<published-image>\"",
    "reason": "No profile OCI image has been built or published. Do not infer an image size from declared package names."
  },
  "sbom": {
    "format": "SPDX-2.3 declared-intent",
    "path": "sbom.spdx.json",
    "sha256": "sha256:c4456e27d04c6d19fc9feaa4e2e71e821c7fbd97005fac3091935fde7bd7011f"
  }
}
